Similarity_Score,Text1,Text2,Group,Date1,Date2,Publisher1,Publisher2,ID1,ID2,proper_nouns1,proper_nouns2,keywords1,keywords2
0.78211117,"Politie beëindigt actie Museumplein; Een demonstratie tegen de coronamaatregelen, gisteren op het Museumplein in Amsterdam, is door de politie ontbonden. Volgens de gemeente is een noodbevel van kracht en is het niet toegestaan om nog op het Museumplein te zijn. Ook in Nijmegen is op last van burgemeester Bruls gisterochtend een verkiezingsbijeenkomst van Forum voor Democratie be indigd wegens het overtreden van de coronaregels. Een onbekend aantal mensen heeft een bekeuring gekregen omdat zij bij het uitdelen van folders de anderhalvemeterregel negeerden. Twee mannen zijn gearresteerd wegens opruiing. De bijeenkomst van FvD op het Kelfkensbos trok ook tegendemonstranten, waardoor het te druk werd. Bruls besloot daarop de straat te laten ontruimen.","Forum voor Democratie Jacht  op extra stemmen; Waar andere partijen zich nauwelijks op straat wagen toert Forum voor Democratie stad en land af. Die optredens trekken niet alleen de aandacht van kiezers het Openbaar Ministerie kijkt inmiddels of Baudets campagneteam niet op grote schaal de coronaregels geschonden heeft. Zo werden bij een bezoek aan Urk volgens getuigen honderden handen geschud. En dan was er nog de volmacht-rel. In een live-uitzending riep Baudet donderdag zijn kijkers op zoveel mogelijk stemmen per volmacht te regelen. Om de besmettingskansen te verkleinen mogen kiezers dit jaar niet twee maar drie volmachtsstemmen uitbrengen. Een persoon kan vier keer stemmen eigenlijk, als je maar die volmachten kunt regelen, aldus Baudet, en dat was een enorme kans. Ho, zei het ministerie van Binnenlandse Zaken dat is niet de bedoeling en mag helemaal niet. Daar leek het campagneteam van Forum toen al achter gekomen de suggestie om stemmen te regelen was door de partij schielijk uit het filmpje van Baudet geknipt. Aan een ander standpunt houdt Baudet wel openlijk vast de grote kans op verkiezingsfraude. Door anderen, uiteraard.",high,2021-03-01 00:00:00,2021-03-01 00:00:00,Het Financieele Dagblad,NRC Handelsblad,3290632,3285634,"Forum voor Democratie, Kelfkensbos","Forum voor Democratie, Forum voor Democratie, Ministerie kijkt, Urk, Baudet, Baudet, Baudet, Baudet","['opruiing', 'tegendemonstranten', 'anderhalvemeterregel', 'bekeuring', 'amsterdam']","['besmettingskansen', 'volmachtsstemmen', 'schielijk', 'volmachten', 'baudets']"
0.7732865,"Vaccinatie-paspoort; Commentaar Hans van zon Beetje bij beetje maken politici de geesten rijp voor een digitaal vaccinatiepaspoort. Na de laatste Europese top liet de Duitse kanselier Angela Merkel al doorschemeren dat iedereen akkoord was met de invoering ervan. Voor de zomer zou het een feit kunnen zijn. Premier Mark Rutte reageerde nog terughoudend. Hij was niet tegen, maar vond een besluit erover te vroeg. In een online toespraak voor het partijcongres van D66 mengt nu ook lijsttrekker Sigrid Kaag zich in de discussie. Zij vindt het oneerlijk dat gevaccineerde mensen moeten wachten met leven totdat ook anderen zijn inge nt. Met een digitaal vaccinatiepaspoort op zak moeten zij kunnen genieten van herwonnen vrijheid. Dat er grote voordelen zitten aan de invoering, staat buiten kijf. Op internationaal vlak zou de houder ervan weer onbeperkt vluchten moeten kunnen maken. Het bezit van een paspoort kan in eigen land weer toegang geven tot winkelcentra, bioscopen, restaurants en bijvoorbeeld musea. Isra l, dat door zijn snelle vaccinatie internationaal vooroploopt en daardoor een proeftuin is voor het leven na vaccinatie, werkt al een week met een groen paspoort. h.vanzon@ad.","Start met corona; Lien van der Leij Moet de reguliere zorg weer voorrang krijgen op de coronazorg, ook al zou dat leiden tot meer coronadoden? Met die ethische vraag trapte het RTL-verkiezingsdebat gisteravond af. Na een jaar pandemie dreigen nog steeds overvolle ic's, terwijl steeds meer stemmen opgaan om de coronarestricties te versoepelen. Maar die stelling leverde weinig vuurwerk op oppositie en coalitiepartners waren het met elkaar eens de politiek mag niet op de stoel van de arts gaan zitten. Veel ongemakkelijker waren de een-op-eenontmoetingen met echte kiezers. Zo moest D66-lijsttrekker Sigrid Kaag aan een melkveehouder uitleggen waarom de veestapel volgens haar partij moet worden gehalveerd, terwijl CDA'er Wopke Hoekstra een welhaast failliete caf baas en zijn vrouw geen zekerheid kon geven over hun financi le toekomst. Premier Mark Rutte kwam tegenover een gedupeerde ouder in de toeslagenaffaire te staan. Traditioneel geldt het eerste tv-debat tussen de lijsttrekkers van de grote partijen als het startsein voor kiezers om te gaan nadenken op wie zij hun stem willen uitbrengen, vaak met grote electorale verschuivingen tot gevolg.",high,2021-03-01 00:00:00,2021-03-01 00:00:00,Algemeen Dagblad,Het Financieele Dagblad,3286195,3290656,"Commentaar, Hans van zon Beetje, Angela Merkel, Mark Rutte, D66, Sigrid Kaag, Isra l","Lien van der Leij, Sigrid Kaag, Wopke Hoekstra, Mark Rutte","['vaccinatiepaspoort', 'gevaccineerde', 'herwonnen', 'europese', 'rutte']","['melkveehouder', 'coronarestricties', 'toeslagenaffaire', 'traditioneel', 'coronadoden']"
0.65849555,"De laatste, over integriteit; Hilde Sennema Ze stuurde een foto van haar tuin vol krokussen, blij dat ze de lente nog meemaakt. Een tumor in haar hoofd zorgt dat ze niet meer kan lezen en dat ze er binnenkort niet meer is. Ze verontschuldigde zich bij mijn ouders dat ze mijn columns niet meer volgde. Geeft niks, antwoordde mijn moeder, wij lezen ze ook niet altijd. Dat hun vriendin zelf kiest wanneer ze sterft, is iets waar mijn ouders niet aan kunnen wennen. God geeft het leven en neemt het, geloven ze. Maar net zoals ze nu echt wel eens televisiekijken op zondag, zijn ze ook hierover milder geworden. Steeds beter weten ze de wereld buiten de kerk tegemoet te treden. Zonder van hun geloof te vallen sloten ze vriendschappen buiten de zuil, en spreken ze nu met hun humanistische vriendin over goed sterven. Dat vermogen om oude waarden en overtuigingen hun plaats te laten vinden in een nieuwe werkelijkheid is hard nodig op het moment. Je moet, kortom, integreren een woord, besefte ik laatst, dat veel mooier is dan hedendaags gebruik vaak suggereert.","Kaag (D66) wil meer vrijheden toestaan met vaccinatiebewijs; Kaag deed haar uitspraken zaterdagmiddag op een D66-congres in Veldhoven.,, Laten we als Nederland een voorbeeld nemen aan Isra l, waar gevaccineerde mensen weer toegang krijgen tot het maatschappelijk leven, zei ze.,, En geef degene die het vaccin nog niet heeft gehad dezelfde vrijheid met een negatieve test in de achterzak. Kaag,, Er lijkt bijna een taboe te liggen op het woord vaccinatiebewijs. Maar toch is dat precies wat we nodig zullen hebben. Een moderne versie van, wie kent het niet, het gele boekje. Uiteraard met de garantie van tijdelijkheid, privacyvoorwaarden en het liefst op Europees niveau. Ook wil Kaag dat de overheid gratis snel- en zelftesten verstrekt. ,, We kunnen het leven veilig weer op gang brengen voor al die jongeren en volwassenen die nog niet aan de beurt zijn geweest. Met gratis snel- en zelftesten kunnen hogescholen, universiteiten, sportstadions, restaurants, caf s en winkels weer opengaan. Dit moet volgens Kaag gebeuren als het vaccinatietempo op orde is. De Europese Commissie komt in maart met voorstellen voor een vaccinatiecertificaat.",medium,2021-03-01 00:00:00,2021-03-01 00:00:00,Het Financieele Dagblad,Algemeen Dagblad,3290640,3286178,God,"D66, Laten, Isra, Europese Commissie","['sennema', 'hilde', 'humanistische', 'wennen', 'televisiekijken']","['gevaccineerde', 'vaccinatiebewijs', 'zelftesten', 'sportstadions', 'vaccinatiecertificaat']"
0.81124794,"Meeste partijen maken vliegen paar honderd miljoen euro duurder; Vliegen moet duurder worden, vinden de meeste politieke partijen die hun verkiezingsprogramma hebben laten doorrekenen door het Centraal Planbureau CPB. Een handvol partijen wil via de autobelastingen minder of groener rijden stimuleren. De plannen om vliegen duurder te maken vari ren van een verdubbeling van de vliegbelasting bij het CDA, tot een combinatie van een gedifferentieerde vliegtaks en een CO₂-heffing voor luchtvaartmaatschappijen bij D66. Alleen VVD en 50Plus laten de luchtvaartindustrie helemaal met rust. Volgens de doorrekening van het CPB draait vooral het bedrijfsleven op voor het duurdere vliegticket. Korte en lange vluchten Sinds 1 januari betalen passagiers die vertrekken vanaf een Nederlandse luchthaven een heffing van € 7,85. De verdubbeling die het CDA voorstelt leidt voor gezinnen tot een verwaarloosbare lastenverzwaring, aldus het CPB. Bedrijven zijn per jaar € 100 mln extra kwijt aan vliegen. D66 wil het tarief voor korte vluchten verhogen naar € 20 en voor lange vluchten naar € 15. Ook vinden de democraten dat overstappende passagiers niet moeten worden uitgezonderd van de vliegtaks. Bescheiden begin Zo'n gedragseffect brengt het planbureau wel in kaart voor de kilometerheffing.","Forum voor Democratie Jacht  op extra stemmen; Waar andere partijen zich nauwelijks op straat wagen toert Forum voor Democratie stad en land af. Die optredens trekken niet alleen de aandacht van kiezers het Openbaar Ministerie kijkt inmiddels of Baudets campagneteam niet op grote schaal de coronaregels geschonden heeft. Zo werden bij een bezoek aan Urk volgens getuigen honderden handen geschud. En dan was er nog de volmacht-rel. In een live-uitzending riep Baudet donderdag zijn kijkers op zoveel mogelijk stemmen per volmacht te regelen. Om de besmettingskansen te verkleinen mogen kiezers dit jaar niet twee maar drie volmachtsstemmen uitbrengen. Een persoon kan vier keer stemmen eigenlijk, als je maar die volmachten kunt regelen, aldus Baudet, en dat was een enorme kans. Ho, zei het ministerie van Binnenlandse Zaken dat is niet de bedoeling en mag helemaal niet. Daar leek het campagneteam van Forum toen al achter gekomen de suggestie om stemmen te regelen was door de partij schielijk uit het filmpje van Baudet geknipt. Aan een ander standpunt houdt Baudet wel openlijk vast de grote kans op verkiezingsfraude. Door anderen, uiteraard.",high,2021-03-01 00:00:00,2021-03-01 00:00:00,Het Financieele Dagblad,NRC Handelsblad,3290589,3285635,"miljoen euro duurder, Centraal Planbureau CPB, CDA, D66, CPB, Korte, CDA, CPB, D66","Forum voor Democratie, Forum voor Democratie, Ministerie kijkt, Urk, Baudet, Baudet, Baudet, Baudet","['lastenverzwaring', 'autobelastingen', 'kilometerheffing', 'vliegbelasting', 'gedifferentieerde']","['besmettingskansen', 'volmachtsstemmen', 'schielijk', 'volmachten', 'baudets']"
0.686414,"Laatste coronanieuws: 4729 nieuwe besmettingen, hoger dan weekgemiddelde; 18.50 uur | Aantal nieuwe coronabesmettingen licht gedaald Tot 10.00 uur zondagochtend zijn bij het RIVM 4729 nieuwe coronabesmettingen gemeld. Dat zijn er 237 minder dan gisteren. Wel is het aantal nieuwe coronabesmettingen hoger dan het gemiddelde van vorige week. Toen werden per dag gemiddeld 4605 mensen positief getest, aldus het RIVM. In de ziekenhuizen is het aantal mensen met corona zondag toegenomen, zo meldt het Landelijk Co rdinatiecentrum Pati nten Spreiding 1848 pati nten tegen 1809 op zaterdag. Van hen lagen er zondag 526 op de intensive care tegen 518 op zaterdag. Verder maakte het RIVM bekend dat er 21 overleden covid-patiënten zijn gemeld tegen 41 op zaterdag. Over de afgelopen zeven dagen telde het RIVM gemiddeld vijftig coronadoden per dag, tegen gemiddeld 58 doden per dag een week eerder. Dat cijfer wordt volgens het RIVM mede bepaald door het aantal besmettingen in verpleeghuizen. Er zijn nu 417 verpleeghuizen waar de afgelopen twee weken minimaal n coronabesmetting is geregistreerd tegen 468 een week geleden. 18.45 uur | Opnieuw lockdown in Braziliaanse hoofdstad Zo mag er vanaf acht uur 's avonds geen alcohol meer worden verkocht. 16.","Makers van vaccins redden de mens, niet de belegger; Cor de Horde Wie farmaceut zegt, zegt overwinsten althans, in sommige kringen. Gewapend met een betonnen octrooiwetgeving kunnen pillendraaiers vragen wat ze willen voor levensreddende medicijnen, is de teneur van de critici. Inderdaad zijn er voorbeelden die het imago van de branche geen goed hebben gedaan. Het sappigste verhaal is van Martin Shkreli, die in 2015 zijn Turing Pharmaceuticals de productierechten liet kopen van het medicijn Daraprim. Prompt ging de prijs van $ 13,50 naar $ 750 per pil. Deze actie leverde Shkreli inmiddels gedetineerd, trouwens de bijnaam meest gehate man van Amerika op. In deze tijden van pandemie zijn de kritische volgers van deze bedrijfstak opnieuw alert. Er gaan al stemmen op om het patent op de diverse vaccins tegen het coronavirus opzij te schuiven. GroenLinks breekt een lans voor dwanglicenties, waaronder de fabrikanten verplicht zijn hun kennis te delen met concurrenten. De fabrikanten met patenten misbruiken hun positie om extra winst te boeken, is de redenering. GroenLinks is niet de enige die kritisch is. Afgelopen week werden de bazen van de grote vaccinfabrikanten stevig aan de tand gevoeld in het Europees Parlement.",medium,2021-02-28 00:00:00,2021-03-01 00:00:00,Het Financieele Dagblad,Het Financieele Dagblad,3290679,3290618,"RIVM, RIVM, Pati, RIVM, RIVM, RIVM mede bepaald","Makers van vaccins redden de mens, Cor de Horde, Martin Shkreli, GroenLinks, GroenLinks, Europees Parlement","['meldt', '4605', 'coronabesmettingen', 'besmettingen', 'coronabesmetting']","['farmaceut', 'dwanglicenties', 'pharmaceuticals', 'vaccinfabrikanten', 'gedetineerd']"
0.815462,"Recht op reparatie van apparatuur komt steeds dichterbij; REPAIR CAF S Jeroen Groot en Caitlin Stooker Philip Leenman 68 wijst naar een Senseo. Het koffiezetapparaat van Philips staat in half gedemonteerde toestand op de werkbank in zijn werkkamer in Naarden. Voor het ongeoefende oog valt er weinig te zien aan het binnenste van het apparaat, maar Leenman weet precies wat er mis is. In dit geval betreft het de boiler om het water op temperatuur te brengen. Als het verwarmingselement wordt aangezet terwijl er geen water in zit, gaat het binnen zes seconden stuk, zegt de gepensioneerde ICT'er. Een kapot huishoudelijk apparaat belandt vaak bij het afval, omdat de kosten van reparatie door een professionele reparateur niet in verhouding staan tot de prijs van een nieuwe. Zonde, stelt het al in 2009 opgerichte Repair Caf. Hier zetten dan ook duizenden vrijwilligers zich in om huis-tuin-en-keukenspullen te repareren. Onder wie Leenman. Normaliter komen consumenten langs bij de Repair Caf s, waar vrijwilligers de kapotte spullen beoordelen en indien mogelijk ter plaatse repareren. Maar vanwege het coronavirus werken ook de reparateurs vanuit huis. Inmiddels zijn er in Nederland meer dan 500 Repair Caf s. Caf s, in 36 landen.","Planbureau: vertrek bedrijven reëel risico bij ambitieuze klimaatplannen; De scherpere milieuregels voor de industrie waarmee politieke partijen klimaatwinst hopen te boeken, leiden tot re le risico's dat bedrijven uit Nederland vertrekken. De mondiale broeikasgasuitstoot wordt dan nauwelijks minder. Daarvoor waarschuwt het Planbureau voor de Leefomgeving PBL maandag. De kans op dit zogeheten weglekeffect is het grootst bij de klimaatvoorstellen die de SP, GroenLinks, D66 en in mindere mate de PvdA doen, zegt het PBL. Bij de ChristenUnie en het CDA speelt dit risico minder. Het PBL heeft de verkiezingsprogramma's van deze politieke partijen geanalyseerd op effecten voor klimaat en milieu. De resultaten daarvan werden maandagochtend gepresenteerd. Het PBL rekent dit door op verzoek van de partijen zelf. De grote afwezige was de VVD, die het klimaatdeel van zijn partijprogramma niet liet doorrekenen. In industrie meeste klimaatwinst Uit de analyse blijkt dat alle politieke partijen grote klimaatwinst hopen te halen in de industri le sector. De vermeden uitstoot in 2030 is daar dan ook het grootst met 16 miljoen ton CO2 in de CDA-plannen tot 32 miljoen ton CO2 in de GroenLinks-plannen.",high,2021-03-01 00:00:00,2021-03-01 00:00:00,Het Financieele Dagblad,Het Financieele Dagblad,3290567,3290604,"REPAIR, CAF S Jeroen Groot, Philips, Leenman, Caf, Leenman, Repair Caf s, Caf s","Planbureau, Planbureau voor de Leefomgeving, PBL, SP, GroenLinks, D66, PvdA, PBL, ChristenUnie, CDA, PBL, PBL, VVD","['verwarmingselement', 'reparateurs', 'koffiezetapparaat', 'reparateur', 'boiler']","['broeikasgasuitstoot', 'klimaatwinst', 'leefomgeving', 'milieuregels', 'zogeheten']"
0.774727,"Volgens helft FVD-kiezers is corona een complot; De helft van de Forum voor Democratie-kiezers denkt dat het coronavirus is ontwikkeld om burgers wereldwijd te onderdrukken. Dat blijkt uit onderzoek van Ipsos, in opdracht van Nieuwsuur. 51 procent denkt dat het coronavirus een biologisch wapen is dat in een laboratorium is ontwikkeld. De gemiddelde Nederlander en stemmers op andere partijen delen die opvattingen niet. Onder alle Nederlanders gelooft 11 procent dat het virus bewust is ontwikkeld en 13 procent dat het een biologisch wapen is.","Europese Volt rekent op een  zetel in Den Haag; Tweede Kamerverkiezingen Voor het eerst doet een Pan-Europese partij mee aan de Tweede Kamerverkiezingen. Die trekt, zegt ze zelf, niet alleen jongeren. , Grensoverschrijdende problemen kan je alleen met grensoverschrijdend bestuur oplossen en Volt denkt hier als enige partij serieus over na, aldus voormalig VVD-Kamerlid Arend Jan Boekestijn tegen zijn tienduizenden volgers op Twitter. En daarom zal hij op 17 maart op Volt stemmen. Sander Schimmelpenninck, oud-hoofdredacteur van zakenblad Quote, stemde bij de Europese verkiezingen van 2019 al op de partij en vindt dat de potentie van Volt nog steeds enorm wordt onderschat. Programmamaker Arjen Lubach weigert een stemadvies te geven, maar plaatste de partij wel in de schijnwerpers vanwege de standpunten over kernenergie Volt omarmt kernenergie. En schrijver Geert Mak noemt Volt een aantrekkelijke partij, omdat deze nog niet is besmet door het verleden. Aan aandacht geen gebrek voor Volt en dat werpt zijn vruchten af. Volgens de jongste peilingen stevent de Europese partij af op n zetel in de Tweede Kamer. Maar kritiekloos op de Europese Unie is Volt niet. Dat is nu voorbehouden aan de niet-direct gekozen Europese Commissie.",high,2021-02-28 09:25:32,2021-03-01 00:00:00,NU.nl,NRC Handelsblad,3288497,3285633,"Forum voor Democratie-kiezers, Ipsos","Europese Volt, Volt, Jan Boekestijn, Sander Schimmelpenninck, Volt, Volt, Geert Mak, Tweede Kamer, Europese Commissie","['ipsos', 'coronavirus', 'nieuwsuur', 'nederlanders', 'opvattingen']","['grensoverschrijdende', 'schimmelpenninck', 'europese', 'grensoverschrijdend', 'kritiekloos']"
0.81855553,"Volgens helft FVD-kiezers is corona een complot; De helft van de Forum voor Democratie-kiezers denkt dat het coronavirus is ontwikkeld om burgers wereldwijd te onderdrukken. Dat blijkt uit onderzoek van Ipsos, in opdracht van Nieuwsuur. 51 procent denkt dat het coronavirus een biologisch wapen is dat in een laboratorium is ontwikkeld. De gemiddelde Nederlander en stemmers op andere partijen delen die opvattingen niet. Onder alle Nederlanders gelooft 11 procent dat het virus bewust is ontwikkeld en 13 procent dat het een biologisch wapen is.","De doorrekening van de verkiezingsprogramma's, waar moet je op letten?; Welke partij trekt het meeste geld uit voor onderwijs ? Welk effect hebben de plannen van partijen op de overheidsfinanci n? Welke partijen halen de klimaatdoelen en wie betaalt die rekening? Ook deze verkiezingen komen het Centraal Planbureau en Planbureau voor de Leefomgeving met een doorrekening van de verkiezingsprogramma's. Die presenteren ze vandaag om 10.30 uur. De persconferentie is live te volgen op NOS.nl. Wat berekenen ze? De doorrekeningen geven inzicht in waar politieke partijen echt geld voor willen uittrekken, hoe ze hun beloftes waarmaken en wat de langetermijneffecten van hun plannen zijn. Waar partijen in verkiezingsprogramma's kiezers nog kunnen bedienen van vage termen als vergroening, duurzaamheid of een eerlijker systeem, moeten ze aan de planbureaus concreet laten weten hoe ze dat daadwerkelijk willen bereiken. Dat is een proces van maanden waarin de partijen steeds aanvullende vragen van de bureaus beantwoorden. Met de doorrekeningen in de hand kunnen kiezers de partijprogramma's beter vergelijken. De investeringen en effecten van alle plannen, die totaal verschillend kunnen zijn, worden allemaal op dezelfde manier doorgerekend. Zo valt straks te lezen waar partijen het meeste geld aan willen uitgeven.",high,2021-02-28 10:01:22,2021-03-01 07:12:10,NU.nl,NOS nieuws,3288493,6290567,"Forum voor Democratie-kiezers, Ipsos",Planbureau,"['ipsos', 'coronavirus', 'nieuwsuur', 'nederlanders', 'opvattingen']","['klimaatdoelen', 'doorrekeningen', 'verkiezingsprogramma', 'leefomgeving', 'waarmaken']"
0.6946821,"Lezersbrieven; EEN JAAR CORONA | Ik hoop dat we het nu niet langer afdoen als griep Een jaar verder... AD 28-2. Terwijl de tranen lopen lees ik dit mooi geschreven, aangrijpende artikel en wens de familie veel sterkte. Ik hoop dat de heren Baudet, Engel en volgelingen, mijns inziens meelopers zonder verstand, dit lezen en deze vreselijke ziekte niet langer afdoen als een griepje. Een belediging aan de nabestaanden. Ineke Pappers-Roodenrijs, Vlaardingen. EEN JAAR CORONA II | Ik denk aan de woorden van directeur Marcel Levi Wat een indrukwekkend overzicht over n jaar corona. En wat fijn om de mening van ethicus Theo Boer te lezen over de beeldvorming over ouderen. Hij zegt terecht Er is een merkwaardige focus dat als je een bepaalde leeftijd hebt, je er goed aan doet om eruit te stappen. Ik ben met hem eens dat het alarmerend is dat dit zo vaak geventileerd wordt en moet denken aan de woorden van de Nederlandse ziekenhuisdirecteur in Londen, Marcel Levi Een beschaafde samenleving kenmerkt zich door solidariteit. Diane Thomson, Strijensas.","'Opvallend en veelzeggend dat VVD en CDA hier niet staan'; Een aantal partijen heeft op een persconferentie gereageerd op de doorrekeningen van het CPB en de PBL. En op het feit dat CDA en VVD n et op de persconferentie waren. Vooral de progressieve partijen staan hier, zei GroenLinks-leider Klaver. Opvallend en veelzeggend dat VVD en CDA hier niet staan. Hun programma's zijn sociaal slecht en brengen economische rampspoed, stelt PvdA-Kamerlid Nijboer. Dus ik snap wel dat ze hier niet staan. D66 benadrukt dat blijkt dat Nederland sterker en groener uit de crisis komt, als hun partijprogramma wordt uitgevoerd. De crux is dus dat het wel kan, veel ambities hebben en de economie een steun in de rug geven, zei Kamerlid Van Weyenberg. D66 heeft de CO2-reductie op 60 procent staan in 2030. Dat is relatief ambitieus, maar GroenLinks gaat er nog overheen. Wij komen uit op 63 procent, zei Klaver. Dat is belangrijk, want de uitvoering blijft altijd achter, daarom heb je overshoot nodig.",medium,2021-03-01 00:00:00,2021-03-01 13:15:24,Algemeen Dagblad,NOS liveblog,3286194,3287398,"Lezersbrieven, AD, Baudet, Ineke Pappers-Roodenrijs, Marcel Levi, Theo Boer, Marcel Levi, Thomson, Strijensas","CDA, CPB, PBL, CDA, CDA, Kamerlid Van Weyenberg, ambitieus, GroenLinks","['strijensas', 'roodenrijs', 'vlaardingen', 'thomson', 'lezersbrieven']","['rampspoed', 'doorrekeningen', 'reductie', 'overshoot', 'groener']"
