Similarity_Score,Text1,Text2,Group,Date1,Date2,Publisher1,Publisher2,ID1,ID2,proper_nouns1,proper_nouns2,keywords1,keywords2
0.80196476,"Meeste partijen maken vliegen paar honderd miljoen euro duurder; Vliegen moet duurder worden, vinden de meeste politieke partijen die hun verkiezingsprogramma hebben laten doorrekenen door het Centraal Planbureau CPB. Een handvol partijen wil via de autobelastingen minder of groener rijden stimuleren. De plannen om vliegen duurder te maken vari ren van een verdubbeling van de vliegbelasting bij het CDA, tot een combinatie van een gedifferentieerde vliegtaks en een CO₂-heffing voor luchtvaartmaatschappijen bij D66. Alleen VVD en 50Plus laten de luchtvaartindustrie helemaal met rust. Volgens de doorrekening van het CPB draait vooral het bedrijfsleven op voor het duurdere vliegticket. Korte en lange vluchten Sinds 1 januari betalen passagiers die vertrekken vanaf een Nederlandse luchthaven een heffing van € 7,85. De verdubbeling die het CDA voorstelt leidt voor gezinnen tot een verwaarloosbare lastenverzwaring, aldus het CPB. Bedrijven zijn per jaar € 100 mln extra kwijt aan vliegen. D66 wil het tarief voor korte vluchten verhogen naar € 20 en voor lange vluchten naar € 15. Ook vinden de democraten dat overstappende passagiers niet moeten worden uitgezonderd van de vliegtaks. Bescheiden begin Zo'n gedragseffect brengt het planbureau wel in kaart voor de kilometerheffing.","Niet een lijsttrekker, maar een kiezer brengt Mark Rutte bij RTL in het nauw; Eerste TV-Debat Het format van het verkiezingsdebat op RTL4 ontregelde premier Mark Rutte VVD, die normaliter sto cijns debatten voert.,Een tv-format kan een beslissende rol spelen in een lijsttrekkersdebat. Vooral demissionair premier Mark Rutte VVD zal die les geleerd hebben. De lijsttrekkers naast Rutte ook Geert Wilders PVV, Wopke Hoekstra CDA, Sigrid Kaag D66 , Lilian Marijnissen SP en Jesse Klaver GroenLinks moesten zondagavond in het RTL-debat niet alleen met elkaar in debat, maar ook met een kiezer. De lijsttrekkers kenden het onderwerp niet in het geval van Rutte was dat de Toeslagenaffaire. Ook wisten ze niet wie ze tegenover zich zouden krijgen. Rutte had tot dan toe een vrij eenvoudig debat. Hij kent zijn tegenstanders, debatteert zich behendig onder hun beschuldigingen uit, en gaat onbewogen door. Maar het gesprek met de kiezer had een totaal ander effect. Rutte werd tegenover Kristie Rongen geplaatst. Zij is gedupeerde in de Toeslagenaffaire, die had geleid tot de val van het derde kabinet-Rutte. Wij zaten als ratten in de val. U bent daar ook schuldig aan, zei ze. U niet.",high,2021-03-01 00:00:00,2021-03-01 00:00:00,Het Financieele Dagblad,NRC Handelsblad,3290589,3285627,"miljoen euro duurder, Centraal Planbureau CPB, CDA, D66, CPB, Korte, CDA, CPB, D66","Mark Rutte, RTL, Mark Rutte, Mark Rutte, Geert Wilders, PVV, Wopke Hoekstra, CDA, Sigrid, Lilian Marijnissen, SP, Jesse, GroenLinks, Kristie Rongen","['lastenverzwaring', 'autobelastingen', 'kilometerheffing', 'vliegbelasting', 'gedifferentieerde']","['lijsttrekkersdebat', 'toeslagenaffaire', 'ontregelde', 'cijns', 'marijnissen']"
0.64189565,"Meeste partijen willen hoger minimumloon, maar leggen rekening verschillend neer; Bijna alle partijen willen het wettelijk minimumloon verhogen, maar niet in dezelfde mate en niet op dezelfde manier. Zo laten VVD en CDA de aan het minimumloon gekoppelde WW- en bijstandsuitkeringen niet meestijgen en D66 en de ChristenUnie slechts gedeeltelijk. Daardoor lopen de kosten van de maatregel sterk uiteen van € 0,3 mrd bij het CDA tot € 12,8 mrd bij de SP, zo heeft het Centraal Planbureau CPB uitgerekend. Behalve via uitkeringen is de overheid extra geld kwijt als werkgever. Ook hogere loonkosten bij zorg instellingen komen bij de overheid terecht, al zijn de extra lasten minder groot dan in het bedrijfsleven. In de collectieve sector krijgt 3% van het personeel het minimumloon. In de marktsector is dat 6%. Als het minimumloon omhooggaat, stijgen de lonen die daar vlak boven zitten ook. Uurloon Iedere volwassen werknemer heeft nu recht op een minimumloon van € 1684,80 per maand. Dit bedrag stijgt mee met de gemiddelde stijging van de cao-lonen. Het is nu niet goed terug te rekenen naar een uurloon. VVD, GroenLinks, 50PlusS en Denk blijven uitgaan van het maandloon.",GL: onderzoek naar zaak-Graus; De Tweede Kamer moet onderzoek doen naar beschuldigingen dat PVV-Kamerlid Dion Graus zijn ex-vrouw heeft aangezet tot seks met zijn beveiligers. Dat zegt fractieleider Jesse Klaver van GroenLinks. Graus is 13de op de PVV-kieslijst.,medium,2021-03-01 00:00:00,2021-03-01 00:00:00,Het Financieele Dagblad,Algemeen Dagblad,3290622,3286168,"VVD, CDA, D66, ChristenUnie, CDA, SP, VVD, GroenLinks","zaak-Graus, Tweede Kamer, Dion Graus, Jesse Klaver, GroenLinks","['bijstandsuitkeringen', '50pluss', 'maandloon', 'uurloon', 'mrd']","['kieslijst', 'beschuldigingen', 'beveiligers', 'groenlinks', 'pvv']"
0.63131607,Park Breda en terras in Gelderse Laren ontruimd; Aan het begin van de avond is park Valkenberg in Breda door de politie ontruimd . Volgens de politie was dat nodig omdat de coronaregels niet werden nageleefd. De ontruiming verliep niet vlekkeloos. Vier mensen werden aangehouden omdat ze spullen naar de politie gooiden. Eerder vandaag ging het Amsterdamse Vondelpark opnieuw dicht vanwege te grote drukte. Dat leidde voor zover bekend niet tot incidenten. Ook in Laren in Gelderland greep de politie in. Een restaurant in de Dorpsstraat had mensen opgeroepen langs te komen in het kader van een actie genaamd unlock de horeca. Daar werden kaarsjes aangestoken. Volgens Omroep Gelderland werd het te druk bij het terras en werd daarom besloten tot ontruiming. E n man werd aangehouden vanwege belediging.,"Laatste coronanieuws: 4729 nieuwe besmettingen, hoger dan weekgemiddelde; 18.50 uur | Aantal nieuwe coronabesmettingen licht gedaald Tot 10.00 uur zondagochtend zijn bij het RIVM 4729 nieuwe coronabesmettingen gemeld. Dat zijn er 237 minder dan gisteren. Wel is het aantal nieuwe coronabesmettingen hoger dan het gemiddelde van vorige week. Toen werden per dag gemiddeld 4605 mensen positief getest, aldus het RIVM. In de ziekenhuizen is het aantal mensen met corona zondag toegenomen, zo meldt het Landelijk Co rdinatiecentrum Pati nten Spreiding 1848 pati nten tegen 1809 op zaterdag. Van hen lagen er zondag 526 op de intensive care tegen 518 op zaterdag. Verder maakte het RIVM bekend dat er 21 overleden covid-patiënten zijn gemeld tegen 41 op zaterdag. Over de afgelopen zeven dagen telde het RIVM gemiddeld vijftig coronadoden per dag, tegen gemiddeld 58 doden per dag een week eerder. Dat cijfer wordt volgens het RIVM mede bepaald door het aantal besmettingen in verpleeghuizen. Er zijn nu 417 verpleeghuizen waar de afgelopen twee weken minimaal n coronabesmetting is geregistreerd tegen 468 een week geleden. 18.45 uur | Opnieuw lockdown in Braziliaanse hoofdstad Zo mag er vanaf acht uur 's avonds geen alcohol meer worden verkocht. 16.",medium,2021-02-27 21:15:58,2021-02-28 00:00:00,NOS liveblog,Het Financieele Dagblad,3287530,3290679,Park Breda,"RIVM, RIVM, Pati, RIVM, RIVM, RIVM mede bepaald","['nageleefd', 'vondelpark', 'amsterdamse', 'gelderland', 'kaarsjes']","['meldt', '4605', 'coronabesmettingen', 'besmettingen', 'coronabesmetting']"
0.8588952,"Helft FvD-kiezers: 'Corona is ontwikkeld om burgers te onderdrukken'; De helft van de mensen die op Forum voor Democratie FvD willen stemmen, denkt dat het coronavirus bewust is ontwikkeld om burgers wereldwijd te onderdrukken. 51 procent denkt dat corona een biologisch wapen is dat in een laboratorium is gefabriceerd. Dat blijkt uit onderzoek van Ipsos, in opdracht van Nieuwsuur. De opvattingen van FvD-kiezers over complottheori n wijken behoorlijk af van die van de gemiddelde Nederlander en van stemmers op andere partijen. Ter vergelijking onder alle Nederlanders gelooft 11 procent dat het virus bewust is ontwikkeld en 13 procent dat het een biologisch wapen is. Harde kern Volgens Ipsos-onderzoeker Sjoerd van Heck zijn de gematigde stemmers bij FvD verdwenen. Het percentage complotdenkers is groter geworden. Omdat ze nu een kiezersgroep over hebben die hem no matter what trouw blijven. Dit is de harde kern die overblijft. De lijsttrekker van FvD, Thierry Baudet, is een van de weinige politici die elke dag met een grote bus van stad naar stad reizen. Hij voert fysiek campagne en heeft het vooral over corona. In Urk schudde hij iedereen de hand, alsof er geen pandemie is.","Milieuclubs niet echt blij met doorrekeningen; Milieuorganisaties zijn teleurgesteld over de verkiezingsprogramma s. Want ze zijn niet groen genoeg, vinden ze. De op milieugebied beste coalitie die volgens peilingen een meerderheid zou hebben in beide Kamers van VVD, CDA, GroenLinks, D66 en PvdA zou niet verder komen dan 53 procent reductie van broeikasgassen in 2030, zegt Milieudefensie. Terwijl 65 procent nodig is om een eerlijke bijdrage te leveren aan het Parijsakkoord en Europa 55 procent als doel heeft. Greenpeace Nederland is evenmin te spreken over ieder verkiezingsprogramma en de nagestreefde reductie van CO2 Geen enkele partij ligt op koers om de afspraken uit het Klimaatakkoord van Parijs te halen. Deze club is echter wel blij dat D66 en GroenLinks cruciale stappen willen zetten en ziet ook dat de PvdA, ChristenUnie en SP meer doen dan de huidige klimaatwet. Maar het is volgens Greenpeace onbegrijpelijk dat het CDA achterblijft met 46 procent reductie en zelfs de klimaatwet niet nakomt. Dat de VVD geen klimaatplannen heeft laten doorrekenen is onverantwoordelijk.",high,2021-02-27 21:52:54,2021-03-01 12:57:21,Nieuwsuur,NOS liveblog,3287578,3287399,"FvD-kiezers, Forum voor Democratie, Ipsos, FvD-kiezers, Thierry Baudet","Milieuclubs, Kamers, CDA, GroenLinks, D66, PvdA, Greenpeace, D66, GroenLinks, PvdA, ChristenUnie, SP, Greenpeace, CDA","['ipsos', 'complotdenkers', 'coronavirus', 'thierry', 'urk']","['greenpeace', 'nagestreefde', 'doorrekeningen', 'milieuclubs', 'klimaatakkoord']"
0.7106497,"De laatste, over integriteit; Hilde Sennema Ze stuurde een foto van haar tuin vol krokussen, blij dat ze de lente nog meemaakt. Een tumor in haar hoofd zorgt dat ze niet meer kan lezen en dat ze er binnenkort niet meer is. Ze verontschuldigde zich bij mijn ouders dat ze mijn columns niet meer volgde. Geeft niks, antwoordde mijn moeder, wij lezen ze ook niet altijd. Dat hun vriendin zelf kiest wanneer ze sterft, is iets waar mijn ouders niet aan kunnen wennen. God geeft het leven en neemt het, geloven ze. Maar net zoals ze nu echt wel eens televisiekijken op zondag, zijn ze ook hierover milder geworden. Steeds beter weten ze de wereld buiten de kerk tegemoet te treden. Zonder van hun geloof te vallen sloten ze vriendschappen buiten de zuil, en spreken ze nu met hun humanistische vriendin over goed sterven. Dat vermogen om oude waarden en overtuigingen hun plaats te laten vinden in een nieuwe werkelijkheid is hard nodig op het moment. Je moet, kortom, integreren een woord, besefte ik laatst, dat veel mooier is dan hedendaags gebruik vaak suggereert.","Europese Volt rekent op een  zetel in Den Haag; Tweede Kamerverkiezingen Voor het eerst doet een Pan-Europese partij mee aan de Tweede Kamerverkiezingen. Die trekt, zegt ze zelf, niet alleen jongeren. , Grensoverschrijdende problemen kan je alleen met grensoverschrijdend bestuur oplossen en Volt denkt hier als enige partij serieus over na, aldus voormalig VVD-Kamerlid Arend Jan Boekestijn tegen zijn tienduizenden volgers op Twitter. En daarom zal hij op 17 maart op Volt stemmen. Sander Schimmelpenninck, oud-hoofdredacteur van zakenblad Quote, stemde bij de Europese verkiezingen van 2019 al op de partij en vindt dat de potentie van Volt nog steeds enorm wordt onderschat. Programmamaker Arjen Lubach weigert een stemadvies te geven, maar plaatste de partij wel in de schijnwerpers vanwege de standpunten over kernenergie Volt omarmt kernenergie. En schrijver Geert Mak noemt Volt een aantrekkelijke partij, omdat deze nog niet is besmet door het verleden. Aan aandacht geen gebrek voor Volt en dat werpt zijn vruchten af. Volgens de jongste peilingen stevent de Europese partij af op n zetel in de Tweede Kamer. Maar kritiekloos op de Europese Unie is Volt niet. Dat is nu voorbehouden aan de niet-direct gekozen Europese Commissie.",high,2021-03-01 00:00:00,2021-03-01 00:00:00,Het Financieele Dagblad,NRC Handelsblad,3290640,3285633,God,"Europese Volt, Volt, Jan Boekestijn, Sander Schimmelpenninck, Volt, Volt, Geert Mak, Tweede Kamer, Europese Commissie","['sennema', 'hilde', 'humanistische', 'wennen', 'televisiekijken']","['grensoverschrijdende', 'schimmelpenninck', 'europese', 'grensoverschrijdend', 'kritiekloos']"
0.77190155,"Wilders in de schijnwerpers; Wilders in de schijnwerpers Den Haag Wilders tegen de rest . Dat was zondagavond de teneur bij het verkiezingsdebat van RTL. Meerdere lijsttrekkers probeerden Mark Rutte VVD te vloeren nu die in de peilingen nog steeds fier aan kop staat. Dat lukte niet. Het was vooral Wilders die opviel. Zo wist hij Sigrid Kaag D66 op de kast te krijgen met een discussie over diversiteitsquota. Dat k n toch niet, riep ze uit toen Wilders zei dat hij niet houdt van dit soort quota, maar wel graag iemand van kleur wil nomineren voor de positie van minister van Cultuur, namelijk Zwarte Piet. GL er Jesse Klaver ging onderuit door te stellen dat Ronald Koeman nog bondscoach van Oranje is. Dat hij inmiddels allang bij FC Barcelona zit, was hem kennelijk ontgaan.","De kiezer verkeert in onzekerheid, maar de opiniepeiler heeft het ook niet gemakkelijk; column Helaas moet ik het in deze column nog stellen zonder de informatie die het RTL-verkiezingsdebat heeft opgeleverd. Maar ik durf hier toch wel te beweren dat we nog rare dingen gaan beleven, nu de campagne eindelijk is begonnen en het nog maar zestien dagen duurt tot de verkiezingen. Misschien is er bij RTL een keiharde gamechanger of een beslissende oneliner langsgekomen, de afgelopen dagen hebben we die in campagnehistorische beschouwingen genoeg gehoord. Maar meer dan een slimme uithaal maakt iets anders de verkiezingen onvoorspelbaar. Het worden namelijk de coronaverkiezingen. Zoiets als dit hebben we nog nooit meegemaakt, zei politiek strateeg Kay van de Linde zondag bij Buitenhof. Tegenover hem zat campagnestrateeg Hans Anker, en die wist het ook niet. Beiden haalden hun betreurde vriend en politieke junky Erik van Bruggen aan Een campagne is onvoorspelbaar. En dat was dus v r corona een campagne nog onvoorspelbaarder maakt dan die per definitie toch al is. De verkiezingen zijn ook geen evaluatie van het coronabeleid, wat je daar verder ook van vond. Dat oordeel zal binnen afzienbare tijd worden geveld in een parlementaire enqu te.",high,2021-03-01 00:00:00,2021-03-01 00:00:00,De Telegraaf,De Volkskrant,3286364,3285217,"Wilders, Mark Rutte, Sigrid Kaag D66, Wilders, Zwarte Piet, Jesse Klaver, Ronald Koeman, Oranje","RTL, Hans Anker, Erik van Bruggen","['diversiteitsquota', 'ronald', 'rtl', 'zit', 'wilders']","['oneliner', 'strateeg', 'opiniepeiler', 'campagnestrateeg', 'gamechanger']"
0.7992434,"Gods politiek; Stevo Akkerman Zonder enige waarschuwing vooraf plaatste politiek historicus Ewout Klei vorige week een verkiezingsaffiche uit 1952 op twitter. Kiezers, stond er in grote letters, een heilloze politiek voert ons zienderogen naar de ondergang! Een pakkende leuze, afkomstig van het Gereformeerd Politiek Verbond GPV, dat 48 jaar later zou opgaan in de ChristenUnie. Het GPV deed in 1952 voor het eerst mee lijst 12, voor handhaving van gezag en vrijheid beide, kandidaat A. Zijlstra. Het was die naam waardoor ik wakker schrok. In mijn boekenkast staat het boekje Albertus Zijlstra, leven en arbeid, een biografie, geschreven door S. Akkerman, mijn grootvader. En voltooid door dr. C. Smits, omdat mijn grootvader overleed voordat het manuscript gereed was. Ik heb het nooit durven lezen, bang voor een overdosis vrijgemaaktheid. Maar nu ik er toch in begon te bladeren, was ik snel verkocht. Oh, de onwrikbare geloofsartikelen van die tijd, waarvoor men bereid was te lijden en anderen te laten lijden. De eigen taal, mij tegelijkertijd zo vertrouwd en zo vreemd Andere tijden.","Sportscholen demonstratief open: 'Bewegen is nu hard nodig'; Zaterdagochtend half negen , op het dak van Tino Hoogendijk Sport Fitness in Vlaardingen. Instructeur Marco Seij 51 zweept de boel nog eens extra op. Tikkie erbij, jongens, roept hij naar de twee sporters op hometrainers aan weerszijden van hem. De uit de kluiten gewassen mannen volgen zijn orders gedwee glimlachend op. Maar het is nog niet genoeg. Een paar tellen later Vier, drie, twee, n... J, goed zo jongens! Dit gaat goe-hoed! Over de aangrenzende, nagenoeg lege parkeerplaats galmt een housebeat. Op bescheiden volume, om de omwonenden op deze zaterdagochtend niet te storen. Na een minuut of twintig zit het pittige lesje op het dak er op en stappen de twee deelnemers hijgend van de fiets af. Er wordt gewisseld, op een manier die voldoet aan de RIVM-normen. Eerst de sporters die klaar zijn het dak af, dan de sporters die klaar staan het dak op. Nee, ideaal is het niet en een echte sportles eigenlijk ook niet. Niet eerder stonden ze hier op het dak. Hij heeft de hometrainers zelf met een kraan naar boven laten takelen.",high,2021-03-01 00:00:00,2021-03-01 00:00:00,Trouw,Trouw,3285316,3285332,"Stevo Akkerman Zonder, ChristenUnie, GPV, Albertus Zijlstra, S. Akkerman, C. Smits","Tino Hoogendijk Sport, J","['verkiezingsaffiche', 'albertus', 'heilloze', 'ewout', 'zijlstra']","['instructeur', 'hometrainers', 'housebeat', 'zit', 'galmt']"
0.81054246,"Makers van vaccins redden de mens, niet de belegger; Wie farmaceut zegt , zegt overwinsten althans , in sommige kringen . Gewapend met een betonnen octrooiwetgeving kunnen pillendraaiers vragen wat ze willen voor levensreddende medicijnen, is de teneur van de critici. Inderdaad zijn er voorbeelden die het imago van de branche geen goed hebben gedaan. Het sappigste verhaal is van Martin Shkreli, die in 2015 zijn Turing Pharmaceuticals de productierechten liet kopen van het medicijn Daraprim. Prompt ging de prijs van $ 13,50 naar $ 750 per pil. Deze actie leverde Shkreli inmiddels gedetineerd, trouwens de bijnaam meest gehate man van Amerika op. GroenLinks In deze tijden van pandemie zijn de kritische volgers van deze bedrijfstak opnieuw alert. Er gaan al stemmen op om het patent op de diverse vaccins tegen het coronavirus opzij te schuiven. GroenLinks breekt een lans voor dwanglicenties, waaronder de fabrikanten verplicht zijn hun kennis te delen met concurrenten. De fabrikanten met patenten misbruiken hun positie om extra winst te boeken, is de redenering. GroenLinks is niet de enige die kritisch is. Afgelopen week werden de bazen van de grote vaccinfabrikanten stevig aan de tand gevoeld in het Europees Parlement. AstraZeneca minus 3%.","Partij die 'gratis bier' uitdeelt, valt snel door de mand; campagne liberalen hun klimaatplannen in het verkiezingsprogramma niet laten doorrekenen . De VVD vindt de rekenmodellen te gemankeerd, maar volgens andere partijen duikt de partij van Mark Rutte. Bijna nergens ter wereld gebeurt het, en in sommige landen zijn ze maar wat jaloers op deze langjarige Nederlandse traditie het doorrekenen van de verkiezingsprogramma's. Vandaag is het weer zover en net als bij eerdere edities ging er weer een hoop gesteggel aan vooraf. Ook dat is traditie. Eerst een stap terug in de tijd al sinds 1986 biedt het Centraal Planbureau CPB politieke partijen de mogelijkheid om uit te rekenen wat de plannen in hun programma nou precies kosten en of ze bijdragen aan onze welvaart. En sinds 1994 berekent het Planbureau voor de Leefomgeving PBL, en haar voorgangers, wat het effect is op ons milieu. De waarde van deze sommen is vooral dat partijen worden gedwongen om hun plannen concreet te maken, waardoor een vergelijking van programma's mogelijk wordt. Zo valt in n oogopslag te zien welke partij het meest hecht aan investeringen in onderwijs, zorg of infrastructuur. ,, Het is toch belangrijk dat er een onafhankelijke scheidsrechter is, zegt D66-Kamerlid Joost Sneller.",high,2021-02-28 00:00:00,2021-03-01 00:00:00,Het Financieele Dagblad,Algemeen Dagblad,3290697,3286174,"Makers van vaccins redden de mens, Martin Shkreli, GroenLinks, GroenLinks, GroenLinks, Europees Parlement, AstraZeneca minus","Mark Rutte, Centraal Planbureau CPB, Planbureau voor de Leefomgeving PBL, Joost Sneller","['farmaceut', 'dwanglicenties', 'pharmaceuticals', 'vaccinfabrikanten', 'gedetineerd']","['rekenmodellen', 'leefomgeving', 'verkiezingsprogramma', 'klimaatplannen', 'gesteggel']"
0.7507585,"D66-leider Kaag wil alvast open voor wie gevaccineerd is; Mensen die gevaccineerd zijn, moeten met een vaccinatiebewijs snel meer vrijheden krijgen, vindt D66-lijsttrekker Sigrid Kaag. Zij wil vaccinatie belonen door voor deze groep de coronamaatregelen te versoepelen. Voor anderen die nog wachten op een vaccin, moeten er gratis sneltesten komen. Horeca, onderwijs, winkels en voetbalstadions kunnen zo eerder en veilig open, denkt D66. Je kunt niet van gevaccineerde mensen verwachten dat ze wachten met leven totdat de laatste prik is gezet, aldus Kaag. Zij pleit ervoor om de vrijheid te omarmen die het vaccineren kan brengen, ook als dat tijdelijke maatschappelijke tweedeling met zich meebrengt, sprak ze zaterdagmiddag op het online verkiezingscongres van D66. Met het plan levert D66-lijsttrekker Kaag stevige kritiek op het coronabeleid van het kabinet, waar Kaag zelf als minister deel van uitmaakt. Het kabinet staat zeer afhoudend tegenover het idee van vaccinatiebewijzen, omdat dat betekent dat de overheid verschil gaat maken in de behandeling van mensen die wel en niet gevaccineerd zijn. Volgens Kaag zijn toch nodig. D66 gaat de campagne in door zich flink af te zetten tegen het coronabeleid van het kabinet.","En toch is Rutte erbij in verkiezingsdebat van de nummers twee; aanloop 17 maart Niet de lijsttrekkers, maar de runners up van zes partijen kruisten zondagochtend de degens in het verkiezingsdebat van WNL op Zondag. De omroep die een vrolijk rechts geluid belooft, had zich voorgenomen er ook een vrolijk debat te maken, met ludieke introducties van de deelnemers CDA'er Pieter Omtzigt werd weer eens een pitbull genoemd en de kijker weet nu dat VVD-minister Tamara van Ark koekblikken spaart en een fragment van de Amerikaanse komiek Jerry Seinfeld, die grapte dat de nummers twee eigenlijk de eerste verliezers zijn. Desondanks werd het debat bij vlagen uiterst wrevelig. Deels kwam dit door diezelfde opzet van het programma, met zes partijen VVD, PVV, CDA, D66, PvdA en SP die om aandacht moesten vechten in een free for all. Voor veel meer dan een paar snedige oneliners was vaak geen tijd. Wacht effe, dit is geen spelshow, schoot Omtzigt uit zijn slof, nadat WNL-presentator Rick Nieman hem had gemaand niet te ver af te dwalen. Ik geloof dat het best lastig is, Renske, om mij uit te laten praten....",high,2021-03-01 00:00:00,2021-03-01 00:00:00,Trouw,De Volkskrant,3285327,3285230,"Sigrid Kaag, voetbalstadions, D66, D66","WNL, CDA'er Pieter Omtzigt, Tamara van Ark, Jerry Seinfeld, Desondanks, VVD, PVV, CDA, D66, PvdA, SP, Rick Nieman, Renske","['gevaccineerd', 'gevaccineerde', 'sneltesten', 'vaccinatiebewijs', 'vaccineren']","['oneliners', 'ludieke', 'omtzigt', 'pitbull', 'snedige']"
0.77702487,"Manifestatie FvD afgebroken, aanhangers bekeurd voor flyeren zonder afstand; In Nijmegen is een campagnebijeenkomst van Forum voor Democratie met Thierry Baudet eerder be indigd . Dat gebeurde op last van burgemeester Bruls, meldt Omroep Gelderland. Het was op de bijeenkomst te druk, ook omdat er tegendemonstranten op afkwamen. De gemeente kwam daarop met een noodbevel. De politie heeft ook een onbekend aantal mensen bekeurd omdat zij folders uitdeelden zonder daarbij 1,5 meter afstand te houden. Flyeren mag volgens de politie alleen als de folders niet van de ene hand in de andere worden gegeven. Twee mannen zijn opgepakt wegens opruiing.","Rechts wil minder verplicht betalen aan pensioen, links meer; Coalitiepartijen VVD en D66 willen de verplichting voor werknemers om pensioen op te bouwen verlagen . Oppositiepartijen GroenLinks, Partij van de Arbeid en SP willen juist dat alle werkenden, werknemers en zelfstandigen verplicht gaan worden om pensioenpremie te betalen. Dat blijkt uit de doorrekeningen van de verkiezingsprogramma's van het Centraal Planbureau. Werknemers die nu onder een verplichte pensioenregeling vallen, het leeuwendeel van de werkenden in Nederland, bouwen doorgaans pensioen op over een salaris tot € 112.000. VVD en D66 willen dat bedrag verlagen naar € 60.000. Daarboven wordt het voor iedereen vrijwillig, maar blijft de pensioenpremie wel net als nu aftrekbaar voor de belastingen. GroenLinks, PvdA en SP hebben juist in hun programma opgenomen dat pensioen ook verplicht wordt voor alle zelfstandigen zonder personeel. Zzp'ers zijn nu vrij in hun keuze om wel of geen pensioen op te bouwen. Ook de circa 400.000 werknemers die nog niet verplicht pensioen opbouwen omdat in hun sector geen verplichtstelling geldt de IT bijvoorbeeld moeten dat volgens deze partijen wel gaan doen. Ter vergelijking werknemers betalen samen met hun werkgever bij pensioenfondsen dit jaar meestal een premie van tussen de 25% en 30%. Bij de grotere partijen blijft die staan op € 112.000.",high,2021-02-28 13:43:06,2021-03-01 00:00:00,NOS liveblog,Het Financieele Dagblad,3287500,3290653,"Forum voor Democratie, Thierry Baudet","pensioen, D66, GroenLinks, Partij van de Arbeid, SP, D66, GroenLinks, PvdA, SP","['meldt', 'tegendemonstranten', 'opruiing', 'bekeurd', 'flyeren']","['pensioenregeling', 'doorrekeningen', 'pensioenpremie', 'pensioenfondsen', 'werkenden']"
