,Similarity_Score,Text1,Text2,Group,Date1,Date2,Publisher1,Publisher2,ID1,ID2,proper_nouns1,proper_nouns2,keywords1,keywords2,unit_id
290,0.7192222,"Misstanden in Qatar al jaren aan de gang; Misstanden in Qatar al jaren aan de gang Optreden tegen Greenpeace . foto anp/hh Vanaf 2016 wisten we al over de arbeidsomstandigheden in Qatar en nu, drie weken voor de verkiezingen, zijn er politici die wakker worden en ons gaan vertellen dat we de wereldkampioenschappen moeten boycotten. Hoe geloofwaardig zijn ze nog, terwijl iedere dag een groot vrachtvliegtuig uit Qatar over mijn huis vliegt? Frans Bohlander Voetbalwereld 6500 doden tijdens de bouw van voetbalstadions in Qatar, tot nu toe. En Nederland overweegt nog steeds om daar te gaan voetballen. Bespottelijk en onbestaanbaar. Ook Johan Derksen vindt dat Nederland moet afhaken. Ronald de Boer vindt dat weer overdreven en nuanceert dat door te zeggen Het zijn er iets minder. Ok, het waren er maar 5000. Ronduit schandalig. Rob de Jonge Westervoort Vergoeding Hugo de Jonge smeekt de horeca om geduld en de terrassen niet open te gooien. Tel. 27/2. Dat is makkelijk te regelen, als de horeca een eerlijke beloning krijgt ter compensatie, iets waar de horeca al tijden om smeekt! R. den Hartog, Utrecht Restaurant We worden overspoeld met berichten dat de terrassen hoe dan ook open moeten.","De Jonge: lijsttrekkers moeten in campagne behoedzaam zijn over corona ; Minister De Jonge van Volksgezondheid vindt het logisch dat lijsttrekkers in de verkiezingscampagne spreken over wat ze graag zouden willen aan versoepelingen, maar hij vindt ook dat ze wel behoedzaam moeten zijn. Qua besmettingscijfers is de situatie nog steeds zorgelijk en er kan nu weinig, zegt De Jonge. Partijgenoot en CDA-lijsttrekker Hoekstra zei gisteren in het RTL-debat dat hij eerlijk moet zijn dat het nu niet kan, maar dat hij hoopt dat de terrassen snel open zijn. Het is logisch dat te hopen, zei De Jonge, maar zo snel als mogelijk is niet vandaag of morgen. Zo zijn er zorgen over de situatie in de kop van Noord-Holland waar erg veel pati nten zijn. In n regio code zwart ligt niet voor de hand, maar we moeten de pati nten goed tussen de regio's verdelen, zegt De Jonge. Maar we met moeten met zijn allen wel code zwart voorkomen.",high,2021-03-01 00:00:00,2021-03-01 12:59:00,De Telegraaf,NOS liveblog,3286377,3287414,"Greenpeace, anp/hh, Qatar, Frans Bohlander, Johan Derksen, Ronald de Boer, Rob, Utrecht Restaurant",Jonge van Volksgezondheid,"['greenpeace', 'ronald', 'derksen', 'nuanceert', 'westervoort']","['besmettingscijfers', 'rtl', 'holland', 'versoepelingen', 'pati']",3286377_3287414
303,0.8514602,"Helft FvD-kiezers: 'Corona is ontwikkeld om burgers te onderdrukken'; De helft van de mensen die op Forum voor Democratie FvD willen stemmen, denkt dat het coronavirus bewust is ontwikkeld om burgers wereldwijd te onderdrukken. 51 procent denkt dat corona een biologisch wapen is dat in een laboratorium is gefabriceerd. Dat blijkt uit onderzoek van Ipsos, in opdracht van Nieuwsuur. De opvattingen van FvD-kiezers over complottheori n wijken behoorlijk af van die van de gemiddelde Nederlander en van stemmers op andere partijen. Ter vergelijking onder alle Nederlanders gelooft 11 procent dat het virus bewust is ontwikkeld en 13 procent dat het een biologisch wapen is. Harde kern Volgens Ipsos-onderzoeker Sjoerd van Heck zijn de gematigde stemmers bij FvD verdwenen. Het percentage complotdenkers is groter geworden. Omdat ze nu een kiezersgroep over hebben die hem no matter what trouw blijven. Dit is de harde kern die overblijft. De lijsttrekker van FvD, Thierry Baudet, is een van de weinige politici die elke dag met een grote bus van stad naar stad reizen. Hij voert fysiek campagne en heeft het vooral over corona. In Urk schudde hij iedereen de hand, alsof er geen pandemie is.","Digitale campagne wordt platter én dieper; Verkiezingen Campagne voeren hoeft niet zo ingewikkeld te zijn. De VVD geeft op Instagram het voorbeeld, met een nieuwe trend, overgewaaid uit het buitenland. Trek de kiezer met grappige plaatjes. Tover een lach tevoorschijn. Wat altijd werkt zijn plaatjes van dieren. Bijvoorbeeld een foto van een kip en een roofvogel. De kip heeft verrassend genoeg de roofvogel op de grond gedwongen. Bijschrift bij de kip VVD met nieuwe plannen om de misdaad aan te pakken. Bij de beteuterde roofvogel staat Zware criminelen. Het oogt als typische internethumor, en zo is het ook bedoeld. De VVD heeft ook zulke plaatjes over kernenergie, met een pitbull en een labradorpuppy in beeld. In een paar woorden geven ze het standpunt van de partij weer. Grappen maken met ogenschijnlijk amateuristisch knip- en plakwerk is geen toeval het ontwapent. Achter de VVD-campagne steken bekende marketingbureaus, gespecialiseerd in het be nvloeden van gedrag. Wat die bureaus precies adviseren en organiseren blijft geheim, zoals bijna alle partijen in verkiezingstijd niet graag in hun keuken laten kijken. Ook de SP heeft zo'n campagne vol beeldgrappen.",high,2021-02-27 21:52:54,2021-03-01 00:00:00,Nieuwsuur,Trouw,3287578,3285375,"FvD-kiezers, Forum voor Democratie, Ipsos, FvD-kiezers, Thierry Baudet","VVD, SP","['ipsos', 'complotdenkers', 'coronavirus', 'thierry', 'urk']","['labradorpuppy', 'internethumor', 'beeldgrappen', 'ontwapent', 'tevoorschijn']",3287578_3285375
305,0.8712741,"Een vraag van een slachtoffer van de toeslagenaffaire aan VVD-lijsttrekker en demissionair premier Rutte; Hoe wil Rutte het vertrouwen terugwinnen ? vraagt Kristie. U heeft mij in de steek gelaten. Rutte zegt begrip te hebben voor de situatie waar de ouders in terechtgekomen zijn. Hij noemt het een schandvlek en een debacle. Maar hij vraagt toch om vertrouwen dat hij de problemen gaat oplossen. Jullie zijn geen fraudeurs, dat wil ik hier gezegd hebben, zegt Rutte. Kristie zegt dat zij geen goede rechtshulp heeft gekregen omdat daarop is bezuinigd door het kabinet. Rutte zegt dat die zaken geen verband houden. De ouders is onrecht aangedaan, zegt hij. Jullie krijgen alle advocatenhulp die er nodig is, is zijn toezegging.","Vraag van de eigenaresse van een couscousbar aan PVV-lijsttrekker Wilders; Nadia wil van Wilders weten hoe zij het aan haar zoon moet uitleggen dat hij als tweederangsburger, geboren en getogen in Nederland, wordt weggezet. Wilders bestrijdt dat hij dat doet. Het gaat hem om de instroom van niet-westerse allochtonen, zegt hij. Nadia en Wilders komen in een heftige discussie terecht, over de islam en over de invloed van andere culturen. Wilders Nederlanders zijn vreemden in hun eigen land geworden. De invloed van de politieke islam is onwenselijk. Nadia Bent u ineens theoloog of zo? Ze nodigt hem uit voor couscous. Dat hoeft voor Wilders niet, maar hij wil wel met haar in gesprek.",high,2021-02-28 22:15:58,2021-02-28 22:43:49,NOS liveblog,NOS liveblog,3287475,3287471,"Kristie, Jullie, Kristie, Jullie","Wilders, Nadia, Wilders, Wilders bestrijdt, Nadia, Nadia Bent","['toeslagenaffaire', 'schandvlek', 'kristie', 'fraudeurs', 'rechtshulp']","['onwenselijk', 'couscousbar', 'couscous', 'nederlanders', 'theoloog']",3287475_3287471
307,0.77442,"Een sterkere EU graag, maar nu is dat even bijzaak; verkiezingen 2021 de campagne Het klimaat, de strijd tegen het virus, de erfenis van het Trump-tijdperk de redenen om als Europese lidstaten nauwer samen te werken, liggen voor het oprapen. De meeste partijen erkennen in hun verkiezingsprogramma's daarom volop de noodzaak van een sterkere Europese Unie. Slechts twee partijen zijn voor een nexit, de PVV en FvD JA21 streeft naar een kleinere Europese Unie. Toch spelen Europa en de Europese Unie nauwelijks een rol van betekenis in de verkiezingscampagne. Zelfs het pro-Europese D66 valt koploper VVD vooral aan op het coronabeleid. Een voor de hand liggende verklaring is dat alle aandacht en inzet voor de virusbestrijding de andere onderwerpen overvleugelt. Maar het is juist ook de pandemie die het besef afgelopen jaar deed doordringen dat Europa hard moet werken aan haar strategische autonomie, bijvoorbeeld door zelfvoorzienend te zijn in geneesmiddelen en vaccins. De bikkelharde strijd om beschermingsmiddelen als mondkapjes van afgelopen voorjaar is nog niet vergeten. De pandemie is bovendien de eerste mondiale crisis zonder duidelijke leiding van de Verenigde Staten, terwijl China die rol nadrukkelijk wel zoekt. Dat komt deels door de coronacrisis.","De Jonge: lijsttrekkers moeten in campagne behoedzaam zijn over corona ; Minister De Jonge van Volksgezondheid vindt het logisch dat lijsttrekkers in de verkiezingscampagne spreken over wat ze graag zouden willen aan versoepelingen, maar hij vindt ook dat ze wel behoedzaam moeten zijn. Qua besmettingscijfers is de situatie nog steeds zorgelijk en er kan nu weinig, zegt De Jonge. Partijgenoot en CDA-lijsttrekker Hoekstra zei gisteren in het RTL-debat dat hij eerlijk moet zijn dat het nu niet kan, maar dat hij hoopt dat de terrassen snel open zijn. Het is logisch dat te hopen, zei De Jonge, maar zo snel als mogelijk is niet vandaag of morgen. Zo zijn er zorgen over de situatie in de kop van Noord-Holland waar erg veel pati nten zijn. In n regio code zwart ligt niet voor de hand, maar we moeten de pati nten goed tussen de regio's verdelen, zegt De Jonge. Maar we met moeten met zijn allen wel code zwart voorkomen.",high,2021-03-01 00:00:00,2021-03-01 12:59:00,Trouw,NOS liveblog,3285325,3287414,"PVV, D66, VVD",Jonge van Volksgezondheid,"['bikkelharde', 'mondkapjes', 'europese', 'oprapen', 'beschermingsmiddelen']","['besmettingscijfers', 'rtl', 'holland', 'versoepelingen', 'pati']",3285325_3287414
312,0.8917924,"'Schrikbarende' lastenverzwaring op komst voor bedrijfsleven; Bedrijven schrikken van de lastenverzwaringen die een nieuwe coalitie van welke signatuur ook in petto heeft. Uit doorrekeningen van het Centraal Planbureau CPB blijkt dat alle partijen extra uitgaven willen financieren door vermogen en winst zwaarder te belasten. Werkgeversorganisatie VNO-NCW waarschuwt dat investeringen daardoor in het gedrang komen. De PvdA gaat het verst, met bijna € 42 mrd aan lastenverzwaringen. De huidige favoriet van de kiezer, de VVD van Mark Rutte, komt ook met een extra rekening van € 3,6 mrd bovenop de € 2 mrd die al in het vat zat. Gemiddeld zou de huidige coalitie op bijna € 9 mrd lastenverzwaring uitkomen, doordat D66 en ChristenUnie de bedrijfslasten met respectievelijk € 15,4 mrd en € 11,4 mrd verhogen en het CDA met € 5,4 mrd. Schrikbarend en zorgelijk Schrikbarend, zegt VNO-NCW in een eerste reactie. En zorgelijk voor Nederland, want zo blijft er minder geld over om te investeren. Dit schaadt de creatie van nieuwe banen en investeringen in klimaat en innovatie, waarschuwen de werkgevers die al zwaar gebukt zeggen te gaan onder de coronacrisis en in te teren op reserves.","'Woningtekort niet opgelost met deze verkiezingsprogramma's'; De plannen voor de woningmarkt van meerdere politieke partijen verschillen maar weinig en lossen het woningtekort niet op. Dat concludeert het Planbureau voor de Leefomgeving PBL in zijn doorrekeningen van de partijprogramma's voor de komende verkiezingen. Het wijst erop dat experts vanuit allerlei hoeken erop wijzen dat er geen silver bullet is die het probleem oplost. Het PBL keek dit jaar voor het eerst naar de plannen voor de woningmarkt, een belangrijk thema deze verkiezingen. Er blijken weinig verschillen te zijn in de maatregelen die de zes onderzochte partijen voorstellen. Bovendien zal er met de voorstellen aan het einde van de komende kabinetsperiode nog altijd een woningtekort zijn, constateert het Planbureau. Volgens het PBL sluiten veel voorstellen voor de woningmarkt aan bij het huidige beleid of zijn ze al beleid. Ze vormen geen trendbreuk met het verleden. Sommige partijen willen een aparte minister die geheel verantwoordelijk is voor het woningaanbod, maar wat die minister anders moet gaan doen dan nu blijft onduidelijk Vooralsnog kan eigenlijk alles wat de partijen wensen, ook binnen de bestaande kaders worden gerealiseerd daar is geen aparte minister voor nodig.",high,2021-03-01 00:00:00,2021-03-01 10:59:13,Het Financieele Dagblad,NOS nieuws,3290621,6290555,"Bedrijven, Centraal Planbureau CPB, PvdA, D66, CDA","Planbureau voor de Leefomgeving, PBL, PBL, Planbureau, PBL, Vooralsnog","['lastenverzwaringen', 'lastenverzwaring', 'doorrekeningen', 'bedrijfslasten', 'schrikbarend']","['doorrekeningen', 'woningaanbod', 'verkiezingsprogramma', 'leefomgeving', 'woningtekort']",3290621_6290555
327,0.8481816,"De uitzending van 1 maart: Gasvrij duurder dan verwacht / IC's vol in Hoorn / Genomineerden Libris Literatuurprijs / Doorrekening verkiezingsprogramma's; Wat kost woning aardgasvrij maken ? Het gaat er deze campagne nog nauwelijks over, maar Nederland staat aan het begin van een ongekende verbouwing. Alle negen miljoen woningen en gebouwen moeten van het gas af, voor het klimaat. In de wijken waar men er als proef al mee begonnen is, is nu voor het eerst gedetailleerd gekeken naar het kostenplaatje. Die blijken veel hoger dan verwacht en zullen de komende jaren bovendien amper dalen. Nieuwsuur spreekt met de onderzoeker van het nieuwe rapport en ging naar het Friese Garijp waar ze de hoge kosten herkennen. IC's liggen vol in Hoorn Terwijl de roep om verdere versoepelingen hard klinkt, zijn de besmettingen in de veiligheidsregio Noord-Holland Noord juist heel erg toegenomen de afgelopen dagen, met name in Hoorn. In de eerste golf werd die regio niet hard getroffen, maar er werden gisteren 133 mensen positief getest. Minister de Jonge riep vandaag lijsttrekkers dan ook op behoedzaam te zijn met uitspraken over versoepelingen. Hij verwees daarbij naar de kop van Noord-Holland. We gaan langs in het Dijklander ziekenhuis en we spreken burgemeester Jan Nieuwenburg.","'Opvallend en veelzeggend dat VVD en CDA hier niet staan'; Een aantal partijen heeft op een persconferentie gereageerd op de doorrekeningen van het CPB en de PBL. En op het feit dat CDA en VVD n et op de persconferentie waren. Vooral de progressieve partijen staan hier, zei GroenLinks-leider Klaver. Opvallend en veelzeggend dat VVD en CDA hier niet staan. Hun programma's zijn sociaal slecht en brengen economische rampspoed, stelt PvdA-Kamerlid Nijboer. Dus ik snap wel dat ze hier niet staan. D66 benadrukt dat blijkt dat Nederland sterker en groener uit de crisis komt, als hun partijprogramma wordt uitgevoerd. De crux is dus dat het wel kan, veel ambities hebben en de economie een steun in de rug geven, zei Kamerlid Van Weyenberg. D66 heeft de CO2-reductie op 60 procent staan in 2030. Dat is relatief ambitieus, maar GroenLinks gaat er nog overheen. Wij komen uit op 63 procent, zei Klaver. Dat is belangrijk, want de uitvoering blijft altijd achter, daarom heb je overshoot nodig.",high,2021-03-01 12:06:47,2021-03-01 13:15:24,Nieuwsuur,NOS liveblog,6290579,3287398,"Friese Garijp, Noord-Holland Noord, Jan Nieuwenburg","CDA, CPB, PBL, CDA, CDA, Kamerlid Van Weyenberg, ambitieus, GroenLinks","['nieuwenburg', 'gasvrij', 'besmettingen', 'aardgasvrij', 'versoepelingen']","['rampspoed', 'doorrekeningen', 'reductie', 'overshoot', 'groener']",6290579_3287398
336,0.8264427,"Verkiezingsdebat trapt af met corona; Moet de reguliere zorg weer voorrang krijgen over de coronazorg, ook al zou dat leiden tot meer coronadoden? Met die ethische vraag trapte het RTL-verkiezingsdebat zondag af. Na een jaar pandemie dreigen nog steeds overvolle ic's, terwijl steeds meer stemmen opgaan om de coronarestricties te versoepelen. Maar die stelling leverde weinig vuurwerk op oppositie en coalitiepartners waren het met elkaar eens de politiek mag niet op de stoel van de arts gaan zitten. Veel ongemakkelijker waren de een-op-een ontmoetingen met kiezers. Zo moest D66-lijsttrekker Sigrid Kaag aan een melkveehouder uitleggen waarom de veestapel volgens haar partij moet worden gehalveerd, terwijl CDA'er Wopke Hoekstra een welhaast failliete caf baas en zijn vrouw geen zekerheid kon geven over hun financi le toekomst. Premier Mark Rutte kwam tegenover een gedupeerde ouder in de toeslagenaffaire te staan. Traditioneel geldt het eerste tv-debat tussen de lijsttrekkers van de grote partijen als het startsein voor kiezers om te gaan nadenken op wie zij hun stem willen uitbrengen, vaak met grote electorale verschuivingen tot gevolg.","Rutte blijft doelwit voor de rest; Nu demissionair premier Mark Rutte met een straatlengte leidt in de peilingen, proberen alle andere lijsttrekkers de VVD-lijsttrekker te beschadigen. Want, verzuchtte, GroenLinks-leider Jesse Klaver tegen Rutte,, U heeft driehonderd zetels in de peilingen. Met nog zestien dagen tot de verkiezingen was het RTL-debat daarom h t toneel om nog wending te geven aan de campagne. Althans, voor de zes genodigden Wopke Hoekstra CDA, Sigrid Kaag D66, Jesse Klaver, Lilian Marijnissen SP, Mark Rutte en Geert Wilders PVV. Rutte is nu immers nog de ongenaakbare leider in de peilingen sommige opiniepeilingen dichten hem net zo veel zetels toe als de nummers twee en drie, PVV en CDA, bij elkaar. Partijen zochten daarom Ruttes bekende achilleshiel, zijn onbetrouwbaarheid en leugens. Daarbij nam ook CDA-leider Wopke Hoekstra, nu nog minister in het kabinet met VVD, zijn huidige kabinetsgenoot op de korrel. Als het gaat om het zwaarder belasten van rijke Nederlanders, wil Rutte nu ineens meer dan de laatste jaren, claimde Hoekstra. U wilde het leenstelsel behouden en niets doen aan de flexcontracten. Glashard.",high,2021-02-28 00:00:00,2021-03-01 00:00:00,Het Financieele Dagblad,Algemeen Dagblad,3290705,3286175,"Sigrid Kaag, Wopke Hoekstra, Mark Rutte","Mark Rutte, Jesse Klaver, Althans, Wopke Hoekstra, CDA, Sigrid, Jesse Klaver, Lilian Marijnissen, SP, Mark Rutte, Geert Wilders, PVV, PVV, CDA, Ruttes, Wopke Hoekstra","['melkveehouder', 'toeslagenaffaire', 'coronarestricties', 'traditioneel', 'verkiezingsdebat']","['ruttes', 'kabinetsgenoot', 'flexcontracten', 'ongenaakbare', 'achilleshiel']",3290705_3286175
360,0.75424045,"Stelling 5: gevaccineerde burgers moeten als eersten hun vrijheid terugkrijgen; D66-lijsttrekker Kaag zei zaterdag al dat zij hiervoor is . Daarnaast moeten we inzetten op massaal sneltesten, voegt zij er vandaag aan toe. Hoekstra zegt dat ervoor gekozen is om de zwaksten als eersten te vaccineren. Maar het kan ook niet om jongeren het langst opgesloten te laten zitten, zegt hij. Daar helpen ook sneltests bij, denkt Hoekstra. PVV-lijsttrekker Wilders en SP-lijsttrekker Marijnissen zijn tegen voordeeltjes voor gevaccineerden en dwang of drang naar burgers toe. Marijnissen zegt dat dat leidt tot een tweedeling in de samenleving, terwijl burgers niet de keus hebben om zich snel te laten vaccineren. VVD-lijsttrekker Rutte is ook tegen, omdat het nog niet duidelijk is of mensen die zijn inge nt niet toch het virus verspreiden. Dus nu nog niet, zegt hij. Klaver van GroenLinks wil dat er vooral ingezet wordt op het zo snel mogelijk vaccineren van iedereen. Kaag vindt dus weinig bijval, en mag daarop reageren. Zij verdedigt haar standpunt met de stelling dat het voor jongeren nu heel erg moeilijk is dat zij thuis moeten zitten. CDA-lijsttrekker Hoekstra is het niet met haar eens. Ouderen worden eerder inge nt dan jongeren.","De kiezer verkeert in onzekerheid, maar de opiniepeiler heeft het ook niet gemakkelijk; column Helaas moet ik het in deze column nog stellen zonder de informatie die het RTL-verkiezingsdebat heeft opgeleverd. Maar ik durf hier toch wel te beweren dat we nog rare dingen gaan beleven, nu de campagne eindelijk is begonnen en het nog maar zestien dagen duurt tot de verkiezingen. Misschien is er bij RTL een keiharde gamechanger of een beslissende oneliner langsgekomen, de afgelopen dagen hebben we die in campagnehistorische beschouwingen genoeg gehoord. Maar meer dan een slimme uithaal maakt iets anders de verkiezingen onvoorspelbaar. Het worden namelijk de coronaverkiezingen. Zoiets als dit hebben we nog nooit meegemaakt, zei politiek strateeg Kay van de Linde zondag bij Buitenhof. Tegenover hem zat campagnestrateeg Hans Anker, en die wist het ook niet. Beiden haalden hun betreurde vriend en politieke junky Erik van Bruggen aan Een campagne is onvoorspelbaar. En dat was dus v r corona een campagne nog onvoorspelbaarder maakt dan die per definitie toch al is. De verkiezingen zijn ook geen evaluatie van het coronabeleid, wat je daar verder ook van vond. Dat oordeel zal binnen afzienbare tijd worden geveld in een parlementaire enqu te.",high,2021-02-28 23:18:22,2021-03-01 00:00:00,NOS liveblog,De Volkskrant,3287467,3285217,"Wilders, Marijnissen, Marijnissen, Klaver van GroenLinks","RTL, Hans Anker, Erik van Bruggen","['sneltesten', 'gevaccineerden', 'gevaccineerde', 'sneltests', 'vaccineren']","['oneliner', 'strateeg', 'opiniepeiler', 'campagnestrateeg', 'gamechanger']",3287467_3285217
383,0.747887,"Wekdienst 28/2: Lijsttrekkers in debat • Kraker in eredivisie: PSV-Ajax; Goedemorgen ! De lijsttrekkers van VVD, PVV, CDA, D66, SP en GroenLinks zijn te zien bij het verkiezingsdebat van RTL Nieuws. En het wordt spannende dag in de Eredivisie, met onder meer de kraker PSV-Ajax. Het weer vanochtend verloopt vrij grijs met mist, nevel en laaghangende bewolking. In de middag breekt vooral in het zuiden de zon geleidelijk door, in het noorden blijft het op veel plaatsen grijs. Het wordt 6 tot 8 graden. Daar waar de zon wel goed kan doorbreken wordt het een graad of 10. De zwakke wind waait uit het noordoosten. Vanavond en vannacht krijgt het hele land opnieuw te maken met lage bewolking en mist. Ga je de weg op? Hier vind je het overzicht van de werkzaamheden. Check hier de dienstregeling voor het spoor. Wat kun je vandaag verwachten? De burgemeesters en natuurorganisaties houden drukte in parken en natuurgebieden scherp in de gaten. De afgelopen tijd was het in verschillende stadsparken veel te druk. Het Vondelpark in Amsterdam moest zelfs worden gesloten.","Meeste partijen willen hoger minimumloon, maar leggen rekening verschillend neer; Bijna alle partijen willen het wettelijk minimumloon verhogen, maar niet in dezelfde mate en niet op dezelfde manier. Zo laten VVD en CDA de aan het minimumloon gekoppelde WW- en bijstandsuitkeringen niet meestijgen en D66 en de ChristenUnie slechts gedeeltelijk. Daardoor lopen de kosten van de maatregel sterk uiteen van € 0,3 mrd bij het CDA tot € 12,8 mrd bij de SP, zo heeft het Centraal Planbureau CPB uitgerekend. Behalve via uitkeringen is de overheid extra geld kwijt als werkgever. Ook hogere loonkosten bij zorg instellingen komen bij de overheid terecht, al zijn de extra lasten minder groot dan in het bedrijfsleven. In de collectieve sector krijgt 3% van het personeel het minimumloon. In de marktsector is dat 6%. Als het minimumloon omhooggaat, stijgen de lonen die daar vlak boven zitten ook. Uurloon Iedere volwassen werknemer heeft nu recht op een minimumloon van € 1684,80 per maand. Dit bedrag stijgt mee met de gemiddelde stijging van de cao-lonen. Het is nu niet goed terug te rekenen naar een uurloon. VVD, GroenLinks, 50PlusS en Denk blijven uitgaan van het maandloon.",high,2021-02-28 07:53:05,2021-03-01 00:00:00,NOS nieuws,Het Financieele Dagblad,3287521,3290622,"VVD, PVV, CDA, D66, SP, GroenLinks, RTL Nieuws, PSV-Ajax","VVD, CDA, D66, ChristenUnie, CDA, SP, VVD, GroenLinks","['waait', 'amsterdam', 'vondelpark', 'goedemorgen', 'verkiezingsdebat']","['bijstandsuitkeringen', '50pluss', 'maandloon', 'uurloon', 'mrd']",3287521_3290622
394,0.82583404,"Moet er meer in de zorg geïnvesteerd worden?; Hoekstra CDA zegt dat er meer ge nvesteerd moet worden in de behandeling van kanker, obesitas en andere ziekten waar veel mensen aan lijden. Marijnissen van de SP vindt het schaamteloos dat de lijsttrekkers van de huidige regeringspartijen zeggen dat er meer geld in de zorg moet worden ge nvesteerd. Zij stemden steeds tegen, zegt zij. GroenLinks-lijsttrekker Klaver wil niet in harde woorden over dit onderwerp debatteren. We hebben elkaar juist nodig, zegt hij. De lijsttrekkers zijn het in ieder geval eens over de invloed die artsen moeten hebben bij dit vraagstuk.","Stelling 4: de rekening van de coronacrisis moet bij de best verdienende Nederlanders terechtkomen; VVD-lijsttrekker Rutte zou het niet raar vinden als de rekening ook bij de hogere inkomens terechtkomt. SP-lijsttrekker Marijnissen vindt dat de inkomensongelijkheid in Nederland veel te groot is geworden. Dat vraagt om een ander belastingstelsel, zegt zij. Rutte is het er niet mee eens dat Hoekstra van het CDA de rekening ook bij de grote supermarkten wil leggen. Ik snap het wel, want zij hebben geprofiteerd van de crisis, maar ze zorgen ook voor veel banen. Hoekstra valt Rutte aan op het financi le beleid. Marijnissen noemt dat een vertoning. Dat juist deze twee consultants van het bedrijfsleven elkaar de maat nemen, zegt zij. Uiteindelijk is het een discussie tussen twee rechtse heren. Als we het aan hen overlaten komt het niet goed. GroenLinks-leider Klaver begrijpt het ook niet. In het verkiezingsprogramma van de VVD staat iets heel anders, zegt hij. Wat is nu waar? In ieder geval zijn Rutte en Hoekstra het met de twee linkse lijsttrekkers eens dat het minimumloon omhoog moet.",high,2021-02-28 21:37:41,2021-02-28 22:48:57,NOS liveblog,NOS liveblog,3287480,3287470,"Hoekstra CDA, SP, juist","Marijnissen, CDA, VVD","['obesitas', 'marijnissen', 'vraagstuk', 'debatteren', 'regeringspartijen']","['inkomensongelijkheid', 'marijnissen', 'belastingstelsel', 'verkiezingsprogramma', 'geprofiteerd']",3287480_3287470
